{
  "capabilities": [
    "RESERVABLE"
  ],
  "connectors": [
    {
      "format": "SOCKET",
      "id": "1",
      "last_updated": "2015-06-29T20:39:09Z",
      "max_amperage": 16,
      "max_voltage": 220,
      "power_type": "AC_3_PHASE",
      "standard": "IEC_62196_T2",
      "tariff_ids": [
        "12"
      ]
    }
  ],
  "evse_id": "BE*BEC*E041503002",
  "floor_level": "-2",
  "last_updated": "2015-06-29T20:39:09Z",
  "physical_reference": "2",
  "status": "AVAILABLE",
  "uid": "3257"
}
